{
  "id": "profession_sent-no-tenin",
  "type": "profession",
  "name": "Sent≈ç no Ten'in",
  "nameJapanese": "",
  "pronunciation": "sen-TOH noh ten-EEN",
  "description": "Bathhouse attendant",
  "category": "general",
  "tags": [
    "profession"
  ],
  "status": "in-progress",
  "completionPercentage": 50,
  "lastModified": "2025-10-06T22:44:43.074Z",
  "contributors": [
    "migration-script"
  ],
  "notes": "Migrated from original markdown documentation. Needs manual review and enhancement."
}