{
  "id": "profession_denki-k-",
  "type": "profession",
  "name": "Denki-kō",
  "nameJapanese": "Denki-kō",
  "pronunciation": "DEN-kee-koh",
  "description": "Electrician (Whisker-Punk era profession)",
  "tags": [
    "profession",
    "technology"
  ],
  "status": "in-progress",
  "completionPercentage": 50,
  "lastModified": "2025-10-07T13:10:53.066Z",
  "contributors": [
    "glossary-migration"
  ],
  "notes": "Migrated from GLOSSARY.md"
}