{
  "id": "profession_ch-koku-ka",
  "type": "profession",
  "name": "Chōkoku-ka",
  "nameJapanese": "Chōkoku-ka",
  "pronunciation": "CHOH-koh-koo-kah",
  "description": "Sculptor",
  "tags": [
    "profession",
    "art"
  ],
  "status": "in-progress",
  "completionPercentage": 50,
  "lastModified": "2025-10-07T13:10:53.066Z",
  "contributors": [
    "glossary-migration"
  ],
  "notes": "Migrated from GLOSSARY.md"
}