{
  "id": "profession_hori-shi",
  "type": "profession",
  "name": "Hori-shi",
  "nameJapanese": "",
  "pronunciation": "HOH-ree-shee",
  "description": "Tattoo artist",
  "category": "general",
  "tags": [
    "profession",
    "body-art"
  ],
  "status": "in-progress",
  "completionPercentage": 50,
  "lastModified": "2025-10-06T22:44:43.074Z",
  "contributors": [
    "migration-script"
  ],
  "notes": "Migrated from original markdown documentation. Needs manual review and enhancement."
}