{
  "id": "profession_tsume-no-geijutsu-ka",
  "type": "profession",
  "name": "Tsume no Geijutsu-ka",
  "nameJapanese": "Tsume no Geijutsu-ka",
  "pronunciation": "TSOO-meh noh gay-JOOT-soo-kah",
  "description": "Claw artist",
  "tags": [
    "profession",
    "body-art"
  ],
  "status": "in-progress",
  "completionPercentage": 50,
  "lastModified": "2025-10-07T13:10:53.066Z",
  "contributors": [
    "glossary-migration"
  ],
  "notes": "Migrated from GLOSSARY.md"
}