{
  "id": "profession_e-shi",
  "type": "profession",
  "name": "E-shi",
  "nameJapanese": "E-shi",
  "pronunciation": "EH-shee",
  "description": "Painter/artist",
  "tags": [
    "profession",
    "art"
  ],
  "status": "in-progress",
  "completionPercentage": 50,
  "lastModified": "2025-10-07T13:10:53.066Z",
  "contributors": [
    "glossary-migration"
  ],
  "notes": "Migrated from GLOSSARY.md"
}