{
  "id": "profession_itamae",
  "type": "profession",
  "name": "Itamae",
  "nameJapanese": "",
  "pronunciation": "ee-tah-MAH-eh",
  "description": "Sushi chef",
  "category": "general",
  "tags": [
    "profession",
    "culinary"
  ],
  "status": "in-progress",
  "completionPercentage": 50,
  "lastModified": "2025-10-06T22:44:43.074Z",
  "contributors": [
    "migration-script"
  ],
  "notes": "Migrated from original markdown documentation. Needs manual review and enhancement."
}