{
  "id": "profession_s-",
  "type": "profession",
  "name": "Sō",
  "nameJapanese": "Sō",
  "pronunciation": "SOH",
  "description": "Temple priest",
  "tags": [
    "profession",
    "spiritual"
  ],
  "status": "in-progress",
  "completionPercentage": 50,
  "lastModified": "2025-10-07T13:10:53.066Z",
  "contributors": [
    "glossary-migration"
  ],
  "notes": "Migrated from GLOSSARY.md"
}