{
  "id": "profession_e-shi",
  "type": "profession",
  "name": "E-shi",
  "nameJapanese": "",
  "pronunciation": "EH-shee",
  "description": "Painter/artist",
  "category": "artisan",
  "tags": [
    "profession",
    "art"
  ],
  "status": "in-progress",
  "completionPercentage": 50,
  "lastModified": "2025-10-06T22:44:43.073Z",
  "contributors": [
    "migration-script"
  ],
  "notes": "Migrated from original markdown documentation. Needs manual review and enhancement."
}