{
  "id": "profession_annai",
  "type": "profession",
  "name": "Annai",
  "nameJapanese": "Annai",
  "pronunciation": "AHN-nigh",
  "description": "Guides who help newcomers and travelers",
  "tags": [
    "profession"
  ],
  "status": "in-progress",
  "completionPercentage": 50,
  "lastModified": "2025-10-07T13:10:53.066Z",
  "contributors": [
    "glossary-migration"
  ],
  "notes": "Migrated from GLOSSARY.md"
}