{
  "id": "profession_hori-shi",
  "type": "profession",
  "name": "Hori-shi",
  "nameJapanese": "Hori-shi",
  "pronunciation": "HOH-ree-shee",
  "description": "Tattoo artist",
  "tags": [
    "profession",
    "body-art"
  ],
  "status": "in-progress",
  "completionPercentage": 50,
  "lastModified": "2025-10-07T13:10:53.066Z",
  "contributors": [
    "glossary-migration"
  ],
  "notes": "Migrated from GLOSSARY.md"
}