{
  "id": "profession_sakka",
  "type": "profession",
  "name": "Sakka",
  "nameJapanese": "",
  "pronunciation": "SAH-kah",
  "description": "Writer",
  "category": "artisan",
  "tags": [
    "profession",
    "art"
  ],
  "status": "in-progress",
  "completionPercentage": 50,
  "lastModified": "2025-10-06T22:44:43.074Z",
  "contributors": [
    "migration-script"
  ],
  "notes": "Migrated from original markdown documentation. Needs manual review and enhancement."
}