{
  "id": "profession_haikan-k-",
  "type": "profession",
  "name": "Haikan-kō",
  "nameJapanese": "Haikan-kō",
  "pronunciation": "HIGH-kahn-koh",
  "description": "Plumber",
  "tags": [
    "profession"
  ],
  "status": "in-progress",
  "completionPercentage": 50,
  "lastModified": "2025-10-07T13:10:53.066Z",
  "contributors": [
    "glossary-migration"
  ],
  "notes": "Migrated from GLOSSARY.md"
}