{
  "id": "profession_sakka",
  "type": "profession",
  "name": "Sakka",
  "nameJapanese": "Sakka",
  "pronunciation": "SAH-kah",
  "description": "Writer",
  "tags": [
    "profession",
    "art"
  ],
  "status": "in-progress",
  "completionPercentage": 50,
  "lastModified": "2025-10-07T13:10:53.066Z",
  "contributors": [
    "glossary-migration"
  ],
  "notes": "Migrated from GLOSSARY.md"
}