{
  "id": "profession_yume-yomi",
  "type": "profession",
  "name": "Yume-yomi",
  "nameJapanese": "Yume-yomi",
  "pronunciation": "YOO-meh-YOH-mee",
  "description": "Dream reader",
  "tags": [
    "profession",
    "spiritual"
  ],
  "status": "in-progress",
  "completionPercentage": 50,
  "lastModified": "2025-10-07T13:10:53.067Z",
  "contributors": [
    "glossary-migration"
  ],
  "notes": "Migrated from GLOSSARY.md"
}