{
  "id": "profession_funa-ko",
  "type": "profession",
  "name": "Funa-ko",
  "nameJapanese": "",
  "pronunciation": "FOO-nah-koh",
  "description": "Boatman, ferry operator",
  "category": "general",
  "tags": [
    "profession"
  ],
  "status": "in-progress",
  "completionPercentage": 50,
  "lastModified": "2025-10-06T22:44:43.073Z",
  "contributors": [
    "migration-script"
  ],
  "notes": "Migrated from original markdown documentation. Needs manual review and enhancement."
}