{
  "id": "profession_kuruma-hiki",
  "type": "profession",
  "name": "Kuruma-hiki",
  "nameJapanese": "Kuruma-hiki",
  "pronunciation": "koo-ROO-mah-HEE-kee",
  "description": "Carter, paw-cart operator",
  "tags": [
    "profession"
  ],
  "status": "in-progress",
  "completionPercentage": 50,
  "lastModified": "2025-10-07T13:10:53.066Z",
  "contributors": [
    "glossary-migration"
  ],
  "notes": "Migrated from GLOSSARY.md"
}