{
  "id": "profession_sent-no-ten-in",
  "type": "profession",
  "name": "Sentō no Ten'in",
  "nameJapanese": "Sentō no Ten'in",
  "pronunciation": "sen-TOH noh ten-EEN",
  "description": "Bathhouse attendant",
  "tags": [
    "profession"
  ],
  "status": "in-progress",
  "completionPercentage": 50,
  "lastModified": "2025-10-07T13:10:53.066Z",
  "contributors": [
    "glossary-migration"
  ],
  "notes": "Migrated from GLOSSARY.md"
}