{
  "id": "profession_hatago-ya",
  "type": "profession",
  "name": "Hatago-ya",
  "nameJapanese": "Hatago-ya",
  "pronunciation": "hah-TAH-goh-yah",
  "description": "Innkeeper",
  "tags": [
    "profession"
  ],
  "status": "in-progress",
  "completionPercentage": 50,
  "lastModified": "2025-10-07T13:10:53.066Z",
  "contributors": [
    "glossary-migration"
  ],
  "notes": "Migrated from GLOSSARY.md"
}