{
  "id": "profession_denki-k",
  "type": "profession",
  "name": "Denki-k≈ç",
  "nameJapanese": "",
  "pronunciation": "DEN-kee-koh",
  "description": "Electrician (Whisker-Punk era profession)",
  "category": "engineering",
  "tags": [
    "profession",
    "technology"
  ],
  "status": "in-progress",
  "completionPercentage": 50,
  "lastModified": "2025-10-06T22:44:43.073Z",
  "contributors": [
    "migration-script"
  ],
  "notes": "Migrated from original markdown documentation. Needs manual review and enhancement."
}