{
  "id": "profession_hikyaku",
  "type": "profession",
  "name": "Hikyaku",
  "nameJapanese": "Hikyaku",
  "pronunciation": "hee-KYAH-koo",
  "description": "Courier, message/package deliverer",
  "tags": [
    "profession"
  ],
  "status": "in-progress",
  "completionPercentage": 50,
  "lastModified": "2025-10-07T13:10:53.066Z",
  "contributors": [
    "glossary-migration"
  ],
  "notes": "Migrated from GLOSSARY.md"
}