{
  "id": "profession_yane-shi",
  "type": "profession",
  "name": "Yane-shi",
  "nameJapanese": "Yane-shi",
  "pronunciation": "YAH-neh-shee",
  "description": "Roofer",
  "tags": [
    "profession"
  ],
  "status": "in-progress",
  "completionPercentage": 50,
  "lastModified": "2025-10-07T13:10:53.067Z",
  "contributors": [
    "glossary-migration"
  ],
  "notes": "Migrated from GLOSSARY.md"
}