{
  "id": "profession_kuruma-hiki",
  "type": "profession",
  "name": "Kuruma-hiki",
  "nameJapanese": "",
  "pronunciation": "koo-ROO-mah-HEE-kee",
  "description": "Carter, paw-cart operator",
  "category": "general",
  "tags": [
    "profession"
  ],
  "status": "in-progress",
  "completionPercentage": 50,
  "lastModified": "2025-10-06T22:44:43.074Z",
  "contributors": [
    "migration-script"
  ],
  "notes": "Migrated from original markdown documentation. Needs manual review and enhancement."
}