{
  "id": "profession_shashin-ka",
  "type": "profession",
  "name": "Shashin-ka",
  "nameJapanese": "Shashin-ka",
  "pronunciation": "SHAH-sheen-kah",
  "description": "Photographer",
  "tags": [
    "profession",
    "technology"
  ],
  "status": "in-progress",
  "completionPercentage": 50,
  "lastModified": "2025-10-07T13:10:53.066Z",
  "contributors": [
    "glossary-migration"
  ],
  "notes": "Migrated from GLOSSARY.md"
}